Count,Title,Release Date,Team,Team1,Team2,Rating,Number of Reviews,Genres,Genre1,Genre2,Genre3,Genre4,Genre5,Genre6,Summary,Plays,Playing,Backlogs,Wishlist,Team Count
1182,The Legend of Zelda: Oracle of Seasons,2001-02-27,"['Nintendo', 'Capcom']",Nintendo, Capcom,3.7,544,"['Adventure', 'RPG']",Adventure,RPG,Not applicable,Not applicable,Not applicable,Not applicable,the legend of zelda oracle of seasons is one of two zelda titles released for the game boy color the other being oracle of ages the game retain many gameplay elements from links awakening such as the graphics audio and topview perspective it also features eight dungeons and a large overworld to explore like in the previous games oracle of seasons is said to be more actionoriented than its counterpart being more puzzleoriented after completing one of the two games both can be linked to form a single linear plot with an alternate ending oracle of seasons and oracle of ages were often credited as being two of the top games for the game boy color,3100,65,1600,489,2
1183,Wild Hearts,2023-02-16,"['Omega Force', 'Electronic Arts']",Omega Force, Electronic Arts,3.2,103,['Adventure'],Adventure,Not applicable,Not applicable,Not applicable,Not applicable,Not applicable,prepare for an epic adventure set in a fantasy world inspired by feudal japan developed by omega force the japanese studio behind dynasty warriors in partnership with electronic arts,73,45,108,246,2
1184,God of War: Ascension,2013-03-12,"['Sony Computer Entertainment Inc', 'SIE Santa Monica Studio']",Sony Computer Entertainment Inc, SIE Santa Monica Studio,2.9,318,"['Adventure', 'Brawler']",Adventure,Brawler,Not applicable,Not applicable,Not applicable,Not applicable,vengeance is born in the fires of betrayal in this prequel to the bestselling god of war franchise six months have passed since kratos stood over the bodies of his wife and child his hands stained with their blood  tricked by ares into murdering the only people he ever loved swearing to avenge them kratos broke the blood oath that bound him to ares but oaths to olympus are not so easily broken sentenced to an eternity chained within a prison for the living damned kratos battles insanity at the hands of the furies he will be tested as he seeks freedom redemption for his sins and the clarity to avenge his family,2700,27,625,351,2
1185,Xenosaga Episode III: Also sprach Zarathustra,2006-07-06,"['Namco Bandai Games', 'Monolith Soft']",Namco Bandai Games, Monolith Soft,4.3,399,"['Adventure', 'RPG']",Adventure,RPG,Not applicable,Not applicable,Not applicable,Not applicable,the story of xenosaga iii starts a year after xenosaga ii ended shion has resigned from vector industries after learning that the company is deeply connected to the appearance of the gnosis she instead joins scientia an underground organization working to unveil vectors secrets in order to bring them down uncover the truth and save mankind in the finale of the xenosaga series which boasts over 3 hours of movies an updated battle system and an improved customization feature with more indepth character specialization and diversification and higher rewards for strategic party management this rpg also includes an easily accessible database feature the xeno bible and a minigame with over 50 levels that challenges both you and your friends,762,23,908,448,2
1186,Kirby's Dream Land 3,1997-11-27,"['Nintendo', 'HAL Laboratory']",Nintendo, HAL Laboratory,3.4,469,"['Adventure', 'Platform']",Adventure,Platform,Not applicable,Not applicable,Not applicable,Not applicable,"that mean old king dedede is at it again hes causing his mischief and dreamlands in trouble kirby the resident hero of dreamland sets out to teach dedede a lesson this time with the help of many of his good friends
but wait somethings wrong dedede doesnt seem to be himself
looks like kirby has to stop dedede and find out what is wrong with him it almost seems like somethings controlling him",2600,49,750,179,2
1187,Castlevania: Harmony of Dissonance,2002-06-06,['Konami Computer Entertainment Tokyo'],Konami Computer Entertainment Tokyo,Not applicable,3.2,399,"['Adventure', 'Platform', 'RPG']",Adventure,Platform,RPG,Not applicable,Not applicable,Not applicable,nearly fifty years has past since simon belmont rescued the land from the curse of dracula now simons descendant juste belmont must acquire the relics of dracula to unravel the disappearance of his childhood friend lydie the castles enchanting mysteries and danger await all those who dare enter,2000,51,802,288,1
1188,Shantae and the Pirate's Curse,2014-10-22,"['WayForward Technologies', 'Intergrow']",WayForward Technologies, Intergrow,3.8,392,"['Adventure', 'Indie', 'Platform', 'RPG']",Adventure,Indie,Platform,RPG,Not applicable,Not applicable,"embark on a brand new adventure with shantae the hairwhipping belly dancing genie when she loses her magic shantae must team up with her nemesis the nefarious pirate risky boots in order to save sequin land from an evil curse as a pirate shantae gains new weapons to advance her quest slay monsters battle epic bosses…and hopefully get her magic back in the bargain but can she really trust her deadliest enemy
the third shantae game is the biggest yet beyond sequin land lie cursed islands and labyrinths each hiding a new piece of pirate gear  flintlock pistol pirate hat scimitar riskys boots and even a cannon upgrade shantaes hair and weapons or unlock advanced fighters moves locate maps return lost heart squids collect rare loot and laugh out loud at the weird wild and wonderfully humorous cast of characters incredible stereoscopic visuals unlockable piratemode multiple endings and an unforgettable soundtrack make this one game you wont want to miss",2200,72,1100,449,2
1189,Happy Wheels,2010-06-04,['Fancy Force'],Fancy Force,Not applicable,2.8,124,"['Adventure', 'Platform', 'Racing']",Adventure,Platform,Racing,Not applicable,Not applicable,Not applicable,try to get to the finish line in this twisted games usercreated tracks having your limbs still attached is optional,5100,3,61,21,1
1190,Guilty Gear XX Accent Core Plus R,2012-09-20,['Arc System Works'],Arc System Works,Not applicable,4.1,423,"['Arcade', 'Fighting']",Arcade,Fighting,Not applicable,Not applicable,Not applicable,Not applicable,"ultimate battle action and the epitome of the guilty gear xx series now on steam
bonus soundtracks included",2500,142,301,142,1
1191,Fire Emblem Fates: Birthright,2015-06-25,"['Intelligent Systems Co Ltd', 'Nintendo']",Intelligent Systems Co Ltd, Nintendo,2.7,405,"['RPG', 'Strategy', 'Turn-Based-Strategy']",RPG,Strategy,Turn-Based-Strategy,Not applicable,Not applicable,Not applicable,"fire emblem fates is split into three story paths birthright is one of the two base stories the other being conquest the other story path can be bought digitally at a discount through the ingame store the third story path is revelation a dlc that was released later you need to be have completed chapter 6 in either game to access the other stories and dlc
birthright is the easier path as it has the ability to use scouting missions to grind experience and money and simpler mission objectives",4300,107,801,260,2
1192,Final Fantasy IV,1991-07-19,"['Square Enix', 'Square']",Square Enix, Square,3.7,530,['RPG'],RPG,Not applicable,Not applicable,Not applicable,Not applicable,Not applicable,"final fantasy iv is the fourth main installment in the final fantasy series developed and published by squaresoft it was released in july 1991 for the super nintendo entertainment system in japan and released as final fantasy ii in north america in october 1991 with alterations made due to nintendo of americas guidelines at the time
the game saw a rerelease in japan on the wonderswan color and a global release on playstation under its original name as part of the final fantasy chronicles and final fantasy anthology collections",2700,60,964,379,2
1193,Devil May Cry 5: Special Edition,2020-11-10,"['Capcom Development Division 1', 'Capcom']",Capcom Development Division 1, Capcom,4.5,265,['Brawler'],Brawler,Not applicable,Not applicable,Not applicable,Not applicable,Not applicable,devil may cry 5 special edition features improved visuals and gameplay at up to 120 frames per second alongside all previouslyreleased downloadable content other additions include vergil as a playable character ray tracing graphics options and two additional game modes legendary dark knight mode which significantly increases the number of enemies in each level and turbo mode which increases the game speed by 20,1000,70,416,286,2
1194,Castlevania III: Dracula's Curse,1990-09-01,"['Konami', 'Palcom']",Konami, Palcom,3.6,501,"['Adventure', 'Platform']",Adventure,Platform,Not applicable,Not applicable,Not applicable,Not applicable,led by the immortal count dracula the greatest army of evil ever assembled is poised to bury mankind in a tomb of terror destroying this legion of swamp dragons slasher skeletons and forces of the undead will be the supreme challenge for the mightiest of warriors your place in history is 100 years before simon belmonts birth dracula is young at heart and it will take more than a stake to penetrate his evil luckily you command the role of trevor  simons forefather and the origin of the belmont warlord chromosomes trevor has a power never before seen by human eyes  the power to transform into three different spirits grant danasty the ferocious ghost pirate sypha the mystic warlord and alucard draculas forgotten son you must perfectly time trevors body transformations to match up his different fighting spirits against ultimate evils trevor also has the strength and wisdom to command the battle axe invisibility potion and mystic whip but the most important weapon trevor has is your cunning to choose the correct paths of fate and your bravery to lead him past 17 possible levels of neverending doom including the haunted ship of fools the sunken city of poltergeists the clock tower of untimely death and curse castle never before have so many dangers confronted you at one time and if by some miracle you triumph youll no longer be a mere mortal youll be a legend wholl live forever,2400,36,606,217,2
1195,Gloomwood,2022-09-05,"['New Blood Interactive', 'David Szymanski']",New Blood Interactive, David Szymanski,4.0,141,"['Adventure', 'Indie', 'Shooter']",Adventure,Indie,Shooter,Not applicable,Not applicable,Not applicable,trapped in a dark victorian city consumed by an ancient curse you must plan your survival and daring escape using nothing but stealth an arsenal of eccentric weapons and your wit in this haunting adventure inspired by the immersive sims and survival horror greats of the late 90s and early 2000s,265,36,338,459,2
1196,Call of Duty: Advanced Warfare,2014-11-03,"['Activision', 'Sledgehammer Games']",Activision, Sledgehammer Games,2.5,415,['Shooter'],Shooter,Not applicable,Not applicable,Not applicable,Not applicable,Not applicable,call of duty advanced warfare envisions the powerful battlegrounds of the future where both technology and tactic have evolved to usher in a new era of combat for the franchise delivering a stunning performance academy award winning actor kevin spacey stars as jonathan irons – one of the most powerful men in the world – shaping this chilling vision of the future of war,5200,13,308,151,2
1197,The Legend of Heroes: Trails of Cold Steel,2013-09-26,"['XSEED Games', 'Nihon Falcom']",XSEED Games, Nihon Falcom,3.7,499,"['Adventure', 'RPG', 'Turn-Based-Strategy']",Adventure,RPG,Turn-Based-Strategy,Not applicable,Not applicable,Not applicable,the legend of heroes trails of cold steel is a roleplaying game and a part of the long running the legend of heroes series of games the basic gameplay is nearly identical to the previous kiseki series entries with a few changes the biggest change to the battle system and also counting as a brand new feature is the tactical link system the tactical link allow players follow up with three different kinds of link attacks dealing additional damage and providing various other benefits tactical link becomes a more useful asset to the player as the story progress and characters level up their link levels with other characters as the link levels increase you will obtain new link abilities such as healing the link partner or increase the cp gain of the partner,2100,129,1000,461,2
1198,Metal Gear Solid 3: Snake Eater HD Edition,2011-11-08,['Konami Digital Entertainment'],Konami Digital Entertainment,Not applicable,4.6,293,"['Adventure', 'Shooter']",Adventure,Shooter,Not applicable,Not applicable,Not applicable,Not applicable,get metal gear solid 3 snake eater hd shooter game for ps3 console from the official playstation website know more about metal gear solid 3 snake eater hd game,2500,34,554,244,1
1199,Mario Kart: Super Circuit,2001-07-21,['Nintendo'],Nintendo,Not applicable,2.8,389,['Racing'],Racing,Not applicable,Not applicable,Not applicable,Not applicable,Not applicable,"classic mario kart action is back once again this time in a colorful lightningfast game that you can take anywhere mario luigi peach toad wario yoshi and bowser are all tearing up the track tossing koopa shells and laying banana peels along the way
mario kart super circuit puts your driving skills to the test on 40 tracks each littered with wild weapons and obstacles choose to play as any of your favorite characters as you speed around classic and brandnew tracks if youre feeling combative try out the creative weaponry mushrooms bananas thunder bolts and stars in battle mode feel like making some friends eat your dust no problem four players can compete in mario kart super circuit using only one game pak if each player has a copy of the game bonus features and new modes of play become available",3700,24,256,101,1
1200,Pokémon Shining Pearl,2021-11-18,"['Nintendo', 'ILCA Inc']",Nintendo, ILCA Inc,2.9,281,"['Adventure', 'RPG', 'Turn-Based-Strategy']",Adventure,RPG,Turn-Based-Strategy,Not applicable,Not applicable,Not applicable,"revisit the sinnoh region and the story of the pokémon pearl version game
experience the nostalgic story from the pokémon pearl version game in a reimagined adventure pokémon shining pearl now on the nintendo switch system adventures in the pokémon shining pearl game will take place in the familiar sinnoh region rich in nature and with mighty mount coronet at its heart sinnoh is a land of many myths passed down through the ages you’ll choose either turtwig chimchar or piplup to be your first partner pokémon and then set off on your journey to become the champion of the pokémon league along the way you’ll be able to encounter the legendary pokémon palkia
adventure together with the pokémon that appeared in the pokémon pearl version game players of the original games can revisit familiar places and relive familiar scenes while first time players can enjoy plenty of fun encounters and surprises that the sinnoh region has to offer the original story and the scale of the sinnoh region’s towns and routes have been faithfully reproduced this remake has also been revitalized with some of the playerfriendly features of modern pokémon games and upcloseandpersonal pokémon battle scenes
whether you played pokémon diamond version or pokémon pearl version back in the day or you’re encountering these games for the first time there’s something for everyone to enjoy",1900,203,444,199,2
1201,PUBG: Battlegrounds,2017-12-20,"['Bluehole Studio', 'PUBG Corp']",Bluehole Studio, PUBG Corp,2.4,299,['Shooter'],Shooter,Not applicable,Not applicable,Not applicable,Not applicable,Not applicable,pubg battlegrounds is a battle royale shooter that pits 100 players against each other in a struggle for survival gather supplies and outwit your opponents to become the last person standing,5200,46,253,32,2
1202,Earthblade,2024-12-31,['Extremely OK Games'],Extremely OK Games,Not applicable,,83,"['Adventure', 'Indie', 'RPG']",Adventure,Indie,RPG,Not applicable,Not applicable,Not applicable,you are névoa an enigmatic child of fate returning at long last to earth in this exploraction platformer from the creators of celeste earthblades lush pixel art world offers seamless exploration challenging combat and countless mysteries to pick apart,0,1,103,529,1
1204,Rule of Rose,2006-01-19,"['Atlus USA', 'Punchline']",Atlus USA, Punchline,3.8,394,"['Adventure', 'Puzzle']",Adventure,Puzzle,Not applicable,Not applicable,Not applicable,Not applicable,"rule of rose is a survival horror game in which the player who controls jennifer explores the game environments and furthers the plot by accomplishing tasks and experiencing cutscenes while sporadically encountering enemies and bosses
taking place in england in 1930 rule of rose centers on jennifer a young woman who is led to an abandoned orphanage by a small boy",727,33,796,770,2
1205,Lollipop Chainsaw,2012-06-12,"['Grasshopper Manufacture', 'WB Games']",Grasshopper Manufacture, WB Games,3.4,295,['Brawler'],Brawler,Not applicable,Not applicable,Not applicable,Not applicable,Not applicable,lollipop chainsaw is the undeadly story of sweet and killer zombie hunter juliet starling and her quest to uncover the root of a colossal zombie outbreak with her wickedly awesome chainsaw in hand juliet slices dices and splits her way through hordes of the undead but soon realizes the horde is only the opening act to a festival of zombie rock lords determined to kill the chainsaw wielding cheerleader,1600,32,717,695,2
1206,Pokémon LeafGreen,2004-01-29,"['Nintendo', 'Game Freak']",Nintendo, Game Freak,3.8,413,"['Adventure', 'RPG', 'Turn-Based-Strategy']",Adventure,RPG,Turn-Based-Strategy,Not applicable,Not applicable,Not applicable,"pokémon leafgreen version and pokémon firered version are a pair of core series generation iii games that are set in the kanto region they were released in japan on january 29 2004 in north america on september 9 2004 in australia on september 23 2004 and in europe on october 1 2004
as the first remakes in the pokémon franchise the games revisit the original pair of pokémon games pokémon red and green versions and so feature all of the characters plot elements and challenges of them but with several important upgrades to bring them up to speed with other generation iii games
the game boy advance wireless adapter was initially included with the games when they were first released eliminating the need for game link cables when trading between the two games and later pokémon emerald version in later copies it was sold separately
firered and leafgreen went on to become the second bestselling games of the game boy advance only behind pokémon ruby and sapphire versions they also received nintendos players choice awards",5900,62,326,128,2
1207,Bowser's Fury,2021-02-12,"['Nintendo', 'Nintendo EAD Tokyo']",Nintendo, Nintendo EAD Tokyo,3.9,497,"['Adventure', 'Platform']",Adventure,Platform,Not applicable,Not applicable,Not applicable,Not applicable,team up with bowser jr in a freeroaming 3d adventure to stop his dad’s rampage run and jump across a series of islands to collect the mysterious cat shines and battle against the colossal fury bowser whenever he emerges from the water to wreak havoc,2100,35,466,314,2
1208,ZeroRanger,2018-09-28,['System Erasure'],System Erasure,Not applicable,4.3,317,"['Arcade', 'Indie', 'Shooter']",Arcade,Indie,Shooter,Not applicable,Not applicable,Not applicable,"zeroranger is a vertically scrolling 2d shootem up with heavy emphasis on shooting dodging and mystery
a menacing alien threat green orange has begun its invasion only two secondary fighters remain against complete annihilation
blast your way through enemy forces in order to unleash your fighters latent potential unlocking new weapons and abilities
but as you grow stronger so does your understanding of the true nature of your adversary",561,30,422,356,1
1209,Labyrinth of Galleria: The Moon Society,2020-11-26,"['Nippon Ichi Software', 'NIS America']",Nippon Ichi Software, NIS America,4.3,49,"['Adventure', 'RPG', 'Strategy']",Adventure,RPG,Strategy,Not applicable,Not applicable,Not applicable,"from the creators of labyrinth of refrain coven of dusk comes a new chapter in the dungeonexploring adventure filled with charm and mystery summoned by the magnificent madame marta you are but a wandering spirit awaiting your next command with the help of eureka madame marta’s assistant and an army of soulinfused puppets you are tasked with delving into the depths of a mysterious underground labyrinth teeming with enchanted monsters to unearth the curios dart that lie within
labyrinth of galleria the moon society offers dungeoncrawling adventures with new quality of life improvements and 50 hours of exploration alongside a cast of fully customizable companions to do your bidding use a variety of pacts and puppet soldiers to customize a team of up to 40 fighters to dive into the darkness and discover the secrets with the labyrinth of galleria…if you dare",67,26,120,193,2
1210,Street Fighter II,1991-02-01,"['Capcom', 'U.S. Gold']",Capcom, U.S. Gold,3.5,433,"['Arcade', 'Fighting']",Arcade,Fighting,Not applicable,Not applicable,Not applicable,Not applicable,"a sequel to street fighter street fighter ii improved upon the many concepts introduced in the first game including the use of commandbased special moves and a sixbutton configuration while offering players a selection of multiple playable characters each with their own unique fighting style and special moves
street fighter ii is credited for starting the fighting game boom during the 1990s its success led to the production of several updated versions each offering additional features and characters over previous versions as well as many home versions some of the home versions of the street fighter ii games have sold millions of copies with the snes port of the first street fighter ii being capcoms bestselling consumer game of alltime as of 2008
street fighter ii follows several of the conventions and rules already established by its original 1987 predecessor the player engages opponents in oneonone close quarter combat in a series of besttwooutofthree matches the objective of each round is to deplete the opponents vitality before the timer runs out if both opponents knock each other out at the same time or the timer runs out with both fighters having an equal amount of vitality left a double ko or draw game is declared and additional rounds will be played until sudden death in the first street fighter ii a match could last up to ten rounds if there was no clear winner this was reduced to four rounds in champion edition and onward if there is no clear winner by the end of the final round then either the computercontrolled opponent will win by default in a singleplayer match or both fighters will lose in a 2player match
after every third match in the single player mode the player will participate in a bonus game for additional points the bonus games includes in order a carbreaking event a barrel breaking bonus game where the barrels are dropped off from a conveyor belt above the player and a drumbreaking bonus game where drums are flammable and piled over each other the bonus games were removed from the arcade version of super street fighter ii turbo
like in the original the games controls uses a configuration of an eightdirectional joystick and six attack buttons the player uses the joystick to jump crouch and move the character towards or away from the opponent as well as to guard the character from an opponents attacks there are three punch buttons and three kick buttons of differing strength and speed light medium and heavy the player can perform a variety of basic moves in any position including grabbingthrowing attacks which were not featured in the original street fighter like in the original the player can perform special moves by inputting a combination of directional and buttonbased commands
street fighter ii differs from the original due to the selection of multiple playable characters each with their distinct fighting styles and special moves additionally the player can also cancel during animation by performing another move allowing for a combination of several basic and special moves both of these features would be expanded upon in subsequent installments",4300,11,158,99,2
1211,Resident Evil: Revelations,2012-01-26,"['Tose', 'Capcom']",Tose, Capcom,3.2,469,"['Adventure', 'Shooter']",Adventure,Shooter,Not applicable,Not applicable,Not applicable,Not applicable,resident evil revelations is a survival horror game that restores elements of the series nature as opposed to the survival action of resident evil 5 the game features a singleplayer mode where the player must complete a series of episodes that involve solving puzzles and defeating enemies and a multiplayer mode where players may fight their way through altered singleplayer scenarios,2900,55,939,297,2
