Count,Title,Release Date,Team,Team1,Team2,Rating,Number of Reviews,Genres,Genre1,Genre2,Genre3,Genre4,Genre5,Genre6,Summary,Plays,Playing,Backlogs,Wishlist,Team Count
844,It Takes Two,2021-03-25,"['Hazelight Studios', 'Electronic Arts']",Hazelight Studios, Electronic Arts,4.2,1300,"['Adventure', 'Platform', 'Puzzle']",Adventure,Platform,Puzzle,Not applicable,Not applicable,Not applicable,embark on the craziest journey of your life in it takes two a genrebending platform adventure created purely for coop invite a friend to join for free with friend’s pass and work together across a huge variety of gleefully disruptive gameplay challenges play as the clashing couple cody and may two humans turned into dolls by a magic spell together trapped in a fantastical world where the unpredictable hides around every corner they are reluctantly challenged with saving their fractured relationship,8100,999,2500,2100,2
845,BioShock,2007-08-21,"['2K Games', '2K Boston']",2K Games, 2K Boston,4.0,1800,"['Adventure', 'RPG', 'Shooter']",Adventure,RPG,Shooter,Not applicable,Not applicable,Not applicable,bioshock is a horrorthemed firstperson shooter set in a steampunk underwater dystopia the player is urged to turn everything into a weapon biologically modifying their own body with plasmids hacking devices and systems upgrading their weapons crafting new ammo variants and experimenting with different battle techniques are all possible the game is described by the developers as a spiritual successor to their previous pc title system shock 2 bioshock received high praise in critical reviews for its atmospheric audio and visual quality absorbing and original plot and its unique gaming experience,17000,339,4000,1200,2
846,Metal Gear Solid,1998-09-03,"['Microsoft', 'Konami Computer Entertainment Japan']",Microsoft, Konami Computer Entertainment Japan,4.2,1900,"['Adventure', 'Tactical']",Adventure,Tactical,Not applicable,Not applicable,Not applicable,Not applicable,metal gear solid is a stealth game created by hideo kojima which follows the msx2 video games metal gear and metal gear 2 solid snake despite a transition to 3d metal gear solids gameplay remains similar to his predecessors the game utilizes a traditional topdown view and the player must navigate the protagonist solid snake through the games areas without being detected detection will set off an alarm which draws armed enemies to his location conversations with snakes allies and cutscenes are used extensively to advance the plot and gain more insight into it metal gear solid is regarded as one of the greatest and most important video games of all time and helped popularize the stealth genre and inengine cinematic cutscenes,12000,287,3000,1600,2
847,Yakuza: Like a Dragon,2020-01-16,"['Sega', 'Ryū Ga Gotoku Studios']",Sega, Ryū Ga Gotoku Studios,4.3,1600,"['Adventure', 'RPG', 'Turn-Based-Strategy']",Adventure,RPG,Turn-Based-Strategy,Not applicable,Not applicable,Not applicable,become ichiban kasuga a lowranking yakuza grunt left on the brink of death by the man he trusted most take up your legendary bat and get ready to crack some underworld skulls in dynamic rpg combat set against the backdrop of modernday japan,6000,847,4800,2800,2
848,Animal Crossing: New Horizons,2020-03-19,"['Nintendo EPD', 'Nintendo']",Nintendo EPD, Nintendo,3.6,1600,['Simulator'],Simulator,Not applicable,Not applicable,Not applicable,Not applicable,Not applicable,escape to a deserted island and create your own paradise as you explore create and customize in animal crossing new horizons your island getaway has a wealth of natural resources that can be used to craft everything from tools to creature comforts you can hunt down insects at the crack of dawn decorate your paradise throughout the day or enjoy sunset on the beach while fishing in the ocean the time of day and season match real life so each day on your island is a chance to check in and find new surprises all year round,20000,1800,1300,1100,2
849,BioShock Infinite,2013-02-26,"['Irrational Games', '2K Games']",Irrational Games, 2K Games,3.5,1500,"['Adventure', 'Shooter']",Adventure,Shooter,Not applicable,Not applicable,Not applicable,Not applicable,bioshock infinite is the third game in the bioshock series it is not a direct sequelprequel to any of the previous bioshock games but takes place in an entirely different setting although it shares similar features gameplay and concepts with the previous games bioshock infinite features a range of environments that force the player to adapt with different weapons and strategies for each situation interior spaces feature close combat with enemies but unlike previous games set in rapture the setting of infinite contains open spaces with emphasis on sniping and ranged combat against as many as fifteen enemies at once,18000,197,4100,949,2
912,Mirror's Edge,2008-11-11,"['Electronic Arts', 'EA Digital Illusions CE']",Electronic Arts, EA Digital Illusions CE,3.5,788,"['Adventure', 'Platform', 'Shooter']",Adventure,Platform,Shooter,Not applicable,Not applicable,Not applicable,in a perfect city were crime is no more and where everything is monitored you play as faith a courier who transports packages via the open rooftops of the city these couriers are known as runners murder has come to this city and now you are being hunted,12000,117,2100,813,2
913,Bayonetta 2,2014-09-20,"['PlatinumGames', 'Nintendo']",PlatinumGames, Nintendo,4.1,1100,['Brawler'],Brawler,Not applicable,Not applicable,Not applicable,Not applicable,Not applicable,the witching hour strikes again brimming with intricate battles that take place in on and all over epic set pieces bayonetta 2 finds our sassy heroine battling angels and demons in unearthly beautiful hd you’re bound to love how it feels to string together combos with unimaginable weapons and to summon demons using bayonetta’s umbran weave in this frantic stylized action game,6000,154,3300,2000,2
914,Sonic Generations,2011-11-01,"['Sonic Team', 'Sega']",Sonic Team, Sega,3.8,1100,"['Adventure', 'Platform']",Adventure,Platform,Not applicable,Not applicable,Not applicable,Not applicable,"celebrate 20 years of sonic in an all new adventure that delivers a definitive experience to sonic fans new and old
the japanese version has different subtitles white time and space for the home consoles and blue adventures for the 3ds version all versions of this game can be played in 3d but a 3dtv as well as a pair of 3d glasses are required for the playstation 3 and xbox 360 versions being the first game of the franchise to be played in 3d it uses stereoscopic 3d with the involvement of a pair of screens in one",9900,133,1700,480,2
915,Shin Megami Tensei: Nocturne,2003-02-20,"['Atlus', 'Ghostlight Ltd.']",Atlus, Ghostlight Ltd.,4.2,1100,['RPG'],RPG,Not applicable,Not applicable,Not applicable,Not applicable,Not applicable,in shin megami tensei iii nocturne the player takes on the role of a young boy who is caught up in the apocalypse while visiting his sick teacher yuko takao with his two classmates chiaki hayasaka and isamu nitta the player must survive in the vortex world with the new powers and capabilities given to the protagonist through magatama obtained from lucifer with these powers the player is given the opportunity to align themselves with a reason that decides what the world will become,4100,358,2500,1300,2
916,Death's Door,2021-07-20,"['Devolver Digital', 'Acid Nerve']",Devolver Digital, Acid Nerve,3.8,738,"['Adventure', 'Brawler', 'Indie', 'RPG']",Adventure,Brawler,Indie,RPG,Not applicable,Not applicable,reaping souls of the dead and punching a clock might get monotonous but its honest work for a crow the job gets lively when your assigned soul is stolen and you must track down a desperate thief to a realm untouched by death  where creatures grow far past their expiry and overflow with greed and power,3300,292,1700,1400,2
917,Devil May Cry 3: Dante's Awakening - Special Edition,2006-01-24,"['Capcom', 'Capcom Production Studio 1']",Capcom, Capcom Production Studio 1,4.4,852,"['Adventure', 'Brawler', 'Shooter']",Adventure,Brawler,Shooter,Not applicable,Not applicable,Not applicable,devil may cry 3 dantes awakening  special edition is a rerelease of devil may cry 3 with gameplay changes and additional content among them there is the possibility to play as vergil on a separate save file,6500,176,1400,481,2
918,Assassin's Creed IV Black Flag,2013-10-29,"['Ubisoft Montreal', 'Ubisoft Entertainment']",Ubisoft Montreal, Ubisoft Entertainment,3.7,1200,"['Adventure', 'Platform']",Adventure,Platform,Not applicable,Not applicable,Not applicable,Not applicable,assassin’s creed iv black flag begins in 1715 when pirates established a lawless republic in the caribbean and ruled the land and seas these outlaws paralyzed navies halted international trade and plundered vast fortunes they threatened the power structures that ruled europe inspired the imaginations of millions and left a legacy that still endures,13000,211,2200,716,2
920,Crisis Core: Final Fantasy VII - Reunion,2022-12-13,['Square Enix'],Square Enix,Not applicable,3.8,409,['RPG'],RPG,Not applicable,Not applicable,Not applicable,Not applicable,Not applicable,crisis core final fantasy vii  reunion is an hd remaster of the smash hit prequel to final fantasy vii in addition to all graphics being remastered in hd fully voiced dialogue and new soundtrack arrangements make for a dynamic new retelling of a beloved classic,1300,284,1000,1300,1
921,Metroid Prime,2002-11-17,"['Nintendo', 'Retro Studios']",Nintendo, Retro Studios,4.3,1400,"['Adventure', 'Platform', 'Shooter']",Adventure,Platform,Shooter,Not applicable,Not applicable,Not applicable,a 3d explorationfocused metroidvania with firstperson shooting mechanics and the first 3d entry in the metroid series metroid prime follows samus aran after the events of metroid 1986 as she boards a space pirate frigate then chases her escaping archrival ridley into the intricately structured tallon iv a planet full of deadly wildlife and former home to the advanced and ancient chozo race,6800,221,2700,1200,2
922,Sonic the Hedgehog 2,1992-11-21,"['Sonic Team', 'Sega']",Sonic Team, Sega,3.7,1200,"['Adventure', 'Platform']",Adventure,Platform,Not applicable,Not applicable,Not applicable,Not applicable,dr eggman aka dr robotnik has returned turning helpless animals into robots and forcing them to build his ultimate weapon the death egg but this time sonic has a friend that can help him tails find the 7 chaos emeralds and stop dr robotnik’s evil scheme,10000,56,883,228,2
923,Metal Gear Solid 4: Guns of the Patriots,2008-06-12,"['Kojima Productions', 'Konami']",Kojima Productions, Konami,3.9,1200,"['Adventure', 'Shooter', 'Tactical']",Adventure,Shooter,Tactical,Not applicable,Not applicable,Not applicable,metal gear solid 4 guns of the patriots is the final canonical metal gear game to feature solid snake as the main character the gameplay of the previous games have been kept along with some new features such as the ability to roll on your back and also to hide in bins scattered around the environment most of the story and the relationship between the characters are explained through cutscenes with a considerable length so knowledge of the prior games is recommended to fully understand the story the game also features a complex multiplayer mode entitled metal gear online with some original missions based on the stealth aspects of the singleplayer games,7700,94,2500,1300,2
924,Atomic Heart,2023-02-21,"['Mundfish', 'Focus Entertainment']",Mundfish, Focus Entertainment,3.0,363,"['Adventure', 'RPG', 'Shooter']",Adventure,RPG,Shooter,Not applicable,Not applicable,Not applicable,atomic heart is an adventure firstperson shooter events of which unfolds in an alternate universe during the high noon of the soviet union the principal character of the game is a special agent p3 who after an unsuccessful landing on enterprise 3826 is trying to figure out what went wrong,983,241,676,1100,2
926,Resident Evil 5,2009-03-05,['Capcom'],Capcom,Not applicable,3.1,1000,"['Adventure', 'Shooter']",Adventure,Shooter,Not applicable,Not applicable,Not applicable,Not applicable,resident evil 5 is the seventh video game in the resident evil series it features similar gameplay to resident evil 4 utilizing the same over the shoulder view but this time the environment plays a significant role the player is now dependent on his partner more than in older games when the partners health bar drop down to 0 he will enter the dying stage where the health bar will flash red and gradually lower as he stays like this resident evil 5 also features new types of enemies called majini and mostly are of african descent,10000,176,1600,561,1
927,The World Ends with You,2007-07-26,"['Square Enix', 'Ubisoft Entertainment']",Square Enix, Ubisoft Entertainment,4.2,1000,"['Arcade', 'RPG']",Arcade,RPG,Not applicable,Not applicable,Not applicable,Not applicable,in the game neku sakuraba and his allies are forced to participate in a game that will determine their fate the battle system uses many of the unique features of the nintendo ds including combat that takes place on both screens and attacks performed by certain motions on the touchscreen or by shouting into the microphone elements of japanese youth culture such as fashion food and cell phones are key aspects of the missions,5200,256,2800,1500,2
928,A Hat in Time,2017-10-05,"['Humble Bundle', 'Gears for Breakfast']",Humble Bundle, Gears for Breakfast,4.0,898,"['Adventure', 'Indie', 'Platform']",Adventure,Indie,Platform,Not applicable,Not applicable,Not applicable,a hat in time is a cuteasheck 3d platformer featuring a little girl who stitches hats for wicked powers freely explore giant worlds and recover time pieces to travel to new heights,7200,320,2700,1600,2
929,Scorn,2022-10-14,"['Ebb Software', 'Kepler Interactive']",Ebb Software, Kepler Interactive,3.0,348,"['Adventure', 'Indie', 'Puzzle']",Adventure,Indie,Puzzle,Not applicable,Not applicable,Not applicable,scorn is an atmospheric first person horror adventure game set in a nightmarish universe of odd forms and somber tapestry it is designed around an idea of being thrown into the world isolated and lost inside this dreamlike world you will explore different interconnected regions in a nonlinear fashion the unsettling environment is a character itself every location contains its own theme story puzzles and characters that are integral in creating a cohesive lived in world throughout the game you will open up new areas acquire different skill sets weapons various items and try to comprehend the sights presented to you,1400,100,747,934,2
930,Fire Emblem: Awakening,2012-04-19,"['Intelligent Systems Co Ltd', 'Nintendo']",Intelligent Systems Co Ltd, Nintendo,3.8,1200,"['Adventure', 'RPG', 'Strategy']",Adventure,RPG,Strategy,Not applicable,Not applicable,Not applicable,"armies clash as the world burns as an inevitable war draws ever closer you must stand with chrom and his forcesknights mages archers and morecommanding them against the armies of kingdoms empires and the dead themselves
plan your strategery move your troops on the battlefield then choose their weapon and attack using the new pair up and dual systems support your attacks with the help of nearby allies and watch their skills and relationships grow",9500,287,2000,814,2
931,Cuphead: The Delicious Last Course,2022-06-30,['Studio MDHR'],Studio MDHR,Not applicable,4.3,398,"['Adventure', 'Indie', 'Platform']",Adventure,Indie,Platform,Not applicable,Not applicable,Not applicable,in cuphead the delicious last course cuphead and mugman are joined by ms chalice for a dlc addon adventure on a brand new island with new weapons new charms and ms chalices brand new abilities take on a new cast of multifaceted screenfilling bosses to assist chef saltbaker in cupheads final challenging quest,2200,154,989,951,1
932,Ori and the Will of the Wisps,2020-03-10,"['Moon Studios', 'Xbox Game Studios']",Moon Studios, Xbox Game Studios,4.3,1200,"['Adventure', 'Platform']",Adventure,Platform,Not applicable,Not applicable,Not applicable,Not applicable,the little spirit ori is no stranger to peril but when a fateful flight puts the owlet ku in harm’s way it will take more than bravery to bring a family back together heal a broken land and discover ori’s true destiny from the creators of the acclaimed actionplatformer ori and the blind forest comes the highly anticipated sequel embark on an allnew adventure in a vast world filled with new friends and foes that come to life in stunning handpainted artwork set to a fully orchestrated original score ori and the will of the wisps continues the moon studios tradition of tightly crafted platforming action and deeply emotional storytelling,6000,263,3700,2200,2
933,Mass Effect,2007-11-20,"['BioWare', 'Microsoft Game Studios']",BioWare, Microsoft Game Studios,3.8,1000,"['RPG', 'Shooter']",RPG,Shooter,Not applicable,Not applicable,Not applicable,Not applicable,"what starts as a routine mission to an agrarian outpost quickly becomes the opening salvo in an epic war as the newly appointed executive officer of the ssv normandy youll assemble and lead an elite squad of heroes into battle after heartpounding battle each decision you make will impact not only your fate but the destiny of the entire galaxy in the mass effect trilogy
key features
incredible interactive storytelling create and customize your own character from commander shepards appearance and skills to a personalized arsenal unleash devastating abilities as you command and train your decisions will control the outcome of each mission your relationships with your crew and ultimately the entire war
an amazing universe to explore from the massive citadel to the harsh radioactive landscape of the krogan home world – the incredible breadth of the mass effect universe will blow you away travel to the farthest outposts aboard the ssv normandy the most technologically advanced ship in the galaxy youll follow the clues left by ancient civilizations discover hidden bases with fantastic new tech and lead your handpicked crew into explosive alien battles
edgeofyourseat excitement meets strategic combat find the perfect combination of squadmates and weapons for each battle if you want to lead them to victory suntzus advice remains as pertinent in 2183 as it is today – know your enemy youll need different tactics for a squad of enemies with devastating biotic attacks than a heavily armored geth colossus so choose your teams wisely",10000,172,2000,774,2
934,Return of the Obra Dinn,2018-10-18,"['3909', 'Lucas Pope']",3909, Lucas Pope,4.3,1000,"['Adventure', 'Indie', 'Puzzle']",Adventure,Indie,Puzzle,Not applicable,Not applicable,Not applicable,in this 1bit firstperson mystery game a merchant ship called the obra dinn has appeared at a london harbor years after being declared lost at sea as an insurance adjuster the player must examine the ship for clues,4700,195,2600,2400,2
935,Kingdom Hearts III,2019-01-25,"['Square Enix', 'Disney Interactive Studios']",Square Enix, Disney Interactive Studios,3.5,1100,"['Adventure', 'Brawler', 'RPG']",Adventure,Brawler,RPG,Not applicable,Not applicable,Not applicable,"kingdom hearts iii is the third main installment in the kingdom hearts series developed and published by square enix it was initially released january 2019 for the playstation 4 and the xbox one an expansion kingdom hearts iii re mind was released in january 2020
the story takes place after the events of kingdom hearts 3d dream drop distance it features an older sora as the main protagonist who sets forth on a new adventure to search for seven guardians of light in an attempt to stop xehanort from bringing about a second keyblade war sora is joined by donald duck goofy mickey mouse riku kairi and others along the way sora travels to many worlds from disney and pixar intellectual properties and cross paths with the real organization xiii
kingdom hearts iii features hack and slash combat reminiscent of kingdom hearts ii with elements from later handheld entries allowing the player to control sora in a party with donald goofy and up to two other disney characters from the various worlds he visits a major addition compared is the formchange mechanic which allows his currently equipped keyblade to grant him special abilities and change shape sora can equip up to three keyblades at a time and cycle between them to use his abilities another addition is the attractions mechanic which occasionally allows sora to summon and pilot a vehicle inspired by disney theme park attractions at certain points throughout the game the player will be able to control other characters",8100,206,2600,1100,2
936,Fallout 3,2008-10-28,"['ZeniMax Media', 'Bethesda Game Studios']",ZeniMax Media, Bethesda Game Studios,3.4,894,"['RPG', 'Shooter']",RPG,Shooter,Not applicable,Not applicable,Not applicable,Not applicable,"fallout 3 from the creators of the awardwinning oblivion featuring one of the most realized game worlds ever created create any kind of character you want and explore the open wastes of postapocalyptic washington dc every minute is a fight for survival as you encounter super mutants ghouls raiders and other dangers of the wasteland prepare for the future
the third game in the fallout series fallout 3 is a singleplayer action roleplaying game rpg set in a postapocalyptic washington dc combining the horrific insanity of the cold war era theory of mutually assured destruction gone terribly wrong with the kitschy naivety of american 1950s nuclear propaganda fallout 3 will satisfy both players familiar with the popular first two games in its series as well as those coming to the franchise for the first time",12000,162,2000,589,2
937,Uncharted: Drake's Fortune,2007-11-16,"['Naughty Dog', 'Sony Computer Entertainment Inc']",Naughty Dog, Sony Computer Entertainment Inc,3.1,882,"['Adventure', 'Platform', 'Shooter']",Adventure,Platform,Shooter,Not applicable,Not applicable,Not applicable,"a 400yearold clue in the coffin of sir francis drake sets a modernday fortune hunter on an exploration for the fabled treasure of el dorado leading to the discovery of a forgotten island in the middle of the pacific ocean
the search turns deadly when nathan drake becomes stranded on the island and hunted by mercenaries outnumbered and outgunned drake and his companions must fight to survive as they begin to unravel the terrible secrets hidden on the island",12000,98,1200,460,2
938,"Zero Escape: Nine Hours, Nine Persons, Nine Doors",2009-12-10,"['Chunsoft', 'Spike']",Chunsoft, Spike,4.2,949,"['Adventure', 'Point-and-Click', 'Puzzle', 'Visual-Novel']",Adventure,Point-and-Click,Puzzle,Visual-Novel,Not applicable,Not applicable,"the first game in the zero escape series originally made as a standalone title nine hours nine persons nine doors the zero escape rebranding and alternative cover of the game were released around the time of the sequel zero escape virtues last reward
the game is a murder mystery visualnovel with a heavy story focus that requires multiple playthroughs to figure out and involves puzzle rooms used to progress through the story with dialogue choices to be made inbetween them
the ios version of the game removed the puzzle rooms to focus more on the visualnovel aspects of the game the puzzle rooms are replaced with narration of the events that take place instead the ios version of the game also has an exclusive ending",6100,162,1800,991,2
939,Lost Judgment,2021-09-24,"['Ryū Ga Gotoku Studios', 'Sega']",Ryū Ga Gotoku Studios, Sega,4.3,790,"['Adventure', 'Brawler', 'RPG']",Adventure,Brawler,RPG,Not applicable,Not applicable,Not applicable,lost judgment once again puts players in the sneakers of lawyer turned streetfighting detective takayuki yagami joined by his partner exyakuza masaharu kaito the crimefighting duo is called on to investigate a seemingly perfect crime whose lead suspect has an airtight alibi what starts out as a tale of revenge reveals a tangled web of conspiracy involving several unlikely factions taking advantage of a broken law system but as victims pile up and yagami unravels the truth he must choose between defending the law or exacting justice,1700,192,1700,1600,2
940,Super Mario 3D Land,2011-11-03,"['Nintendo EAD', 'Nintendo']",Nintendo EAD, Nintendo,3.5,1000,['Platform'],Platform,Not applicable,Not applicable,Not applicable,Not applicable,Not applicable,super mario 3d land is the second 3d super mario platformer for a handheld device and the successor to super mario galaxy 2 the game is closely based on sidescrolling mario games as it combine elements from both traditional 2d mario games and modern freeroaming 3d mario games it also introduces elements into the series including powerups and gameplay mechanics,12000,146,1000,461,2
941,Gris,2018-12-13,"['Nomada Studio', 'Devolver Digital']",Nomada Studio, Devolver Digital,3.6,911,"['Adventure', 'Indie', 'Platform', 'Puzzle']",Adventure,Indie,Platform,Puzzle,Not applicable,Not applicable,"gris is a hopeful young girl lost in her own world dealing with a painful experience in her life her journey through sorrow is manifested in her dress which grants new abilities to better navigate her faded reality as the story unfolds gris will grow emotionally and see her world in a different way revealing new paths to explore using her new abilities
gris is a serene and evocative experience free of danger frustration or death players will explore a meticulously designed world brought to life with delicate art detailed animation and an elegant original score through the game light puzzles platforming sequences and optional skillbased challenges will reveal themselves as more of gris’s world becomes accessible",6600,227,2700,1500,2
