Count,Title,Release Date,Team,Team1,Team2,Rating,Number of Reviews,Genres,Genre1,Genre2,Genre3,Genre4,Genre5,Genre6,Summary,Plays,Playing,Backlogs,Wishlist,Team Count
299,Super Smash Bros. for Nintendo 3DS,2014-09-13,"['Nintendo', 'Sora']",Nintendo, Sora,3.3,545,['Fighting'],Fighting,Not applicable,Not applicable,Not applicable,Not applicable,Not applicable,super smash bros for nintendo 3ds is the first portable entry in the renowned series in which game worlds collide up to four players battle each other locally or online using some of nintendo’s most wellknown and iconic characters across beautifully designed stages inspired by classic portable nintendo games it’s a genuine massive super smash bros experience that’s available to play on the go anytime anywhere,10000,23,273,96,2
300,The Legend of Heroes: Trails to Azure,2011-09-29,['Nihon Falcom'],Nihon Falcom,Not applicable,4.5,519,"['Adventure', 'RPG', 'Strategy', 'Turn-Based-Strategy']",Adventure,RPG,Strategy,Turn-Based-Strategy,Not applicable,Not applicable,the special support section is back with more members and more cases to solve how will this ragtag group deal with the oncoming threats to crossbells political stability while maintaining their teams foundation,1400,72,714,701,1
301,Super Mario RPG: Legend of the Seven Stars,1996-03-09,"['Square', 'Nintendo']",Square, Nintendo,4.0,832,"['Adventure', 'Platform', 'RPG']",Adventure,Platform,RPG,Not applicable,Not applicable,Not applicable,a jrpg entry in the super mario franchise in which mario meets many unlikely allies in order to jump and fight his way through the mushroom kingdom and collect stars to repair the star road the pathway that grants peoples wishes which was destroyed by smithy the otherworldly entity that hijacked bowsers castle and threw the kingdom into disarray,4400,133,2300,858,2
302,Astral Chain,2019-08-30,"['PlatinumGames', 'Nintendo']",PlatinumGames, Nintendo,3.6,568,"['Adventure', 'Brawler']",Adventure,Brawler,Not applicable,Not applicable,Not applicable,Not applicable,astral chain a brand new action game from platinumgames exclusive to nintendo switch as part of a police special task force it’s up to you to fight against mysterious alienlike creatures who have invaded the world,3600,210,2300,1400,2
303,DmC: Devil May Cry,2013-01-15,"['Ninja Theory', 'Capcom']",Ninja Theory, Capcom,3.0,432,"['Adventure', 'Brawler']",Adventure,Brawler,Not applicable,Not applicable,Not applicable,Not applicable,dmc devil may cry is the fifth game in the hackandslash thirdperson action series and the first not largely developed by capcom this title is a reimagining of the series with the same protagonist dante but set in an alternate universe the dante in this game is very different from before doing away with the trademark white hair and altering the main character as well as the games tone with a much more western influence the gameplay is still largely identical as dante engages many opponents with a fast fighting style stringing together combos and hits in quick succession,6300,62,1200,448,2
304,Dragon Age: Origins,2009-11-03,"['Electronic Arts', 'BioWare']",Electronic Arts, BioWare,4.0,712,['RPG'],RPG,Not applicable,Not applicable,Not applicable,Not applicable,Not applicable,dragon age origins is a thirdperson roleplaying game described as a spiritual successor to baldurs gate and neverwinter nights franchises players create their own character by customizing gender and appearance as well as choosing a race and class combat is in real time with the ability to pause at any moment tactical options include an editor which allows the player to give the ai detailed instructions on how to behave in every possible situation although the main storyline is the same for every character created the game features six unique prologues two for each race dragon age origins received critical acclaim upon release with praise mostly directed at its story setting characters music and combat system,6100,148,1700,534,2
305,Vagrant Story,2000-02-10,"['Square', '(Archive) Square Product Development Division 4']",Square, (Archive) Square Product Development Division 4,4.0,503,"['Adventure', 'RPG']",Adventure,RPG,Not applicable,Not applicable,Not applicable,Not applicable,adventure into a world of unparalleled depth and danger with squaresofts vagrant story in this sweeping dungeoncrawling epic you play as ashley riot a young assassin and spy for the organization known as riskbreakers your goal is to unravel a deep and twisted plot and come to terms with the recent death of your wife and child if this sounds a bit too cerebral never fear your path to recapturing your sense of humanity hinges on the destruction of countless vicious monsters and the exploration of dark and dangerous dungeons vagrant story is awash in gorgeous scenery and features designs from yasumi matsuno and akihiko yoshida the acclaimed artists and creators behind final fantasy tactics,1000,59,1600,889,2
306,Amnesia: The Dark Descent,2010-09-08,['Frictional Games'],Frictional Games,Not applicable,3.5,525,"['Adventure', 'Indie', 'Puzzle']",Adventure,Indie,Puzzle,Not applicable,Not applicable,Not applicable,amnesia the dark descent is a survival horror video game by frictional games the game features a protagonist named daniel exploring a dark and foreboding castle while trying to maintain his sanity by avoiding monsters and other terrifying obstructions the game was critically well received,4700,86,1800,407,1
307,Monster Hunter Rise: Sunbreak,2022-06-29,['Capcom'],Capcom,Not applicable,4.3,217,"['Brawler', 'RPG']",Brawler,RPG,Not applicable,Not applicable,Not applicable,Not applicable,"monster hunter rise sunbreak is an expansion to the original monster hunter rise
featuring improved gameplay and nimblefeeling additions to combat mechanics unique new monsters and hunting locales and a new difficulty level in the form of master rank quests
as the hunter who saved kamura from calamity you must now journey to the faroff reaches of elgado an outpost near a kingdom beset by a sinister new nemesis—the elder dragon malzeno",1100,267,327,242,1
308,Super Mario Maker 2,2019-06-28,"['Nintendo EPD', 'Nintendo']",Nintendo EPD, Nintendo,3.7,689,['Platform'],Platform,Not applicable,Not applicable,Not applicable,Not applicable,Not applicable,a sidescrolling mario adventure that unleashes the creative potential of super mario maker 2 awaits in story mode which contains over 100 builtin courses and in course maker a wide range of parts tools and more are available so you can construct your own courses want coinshooting cannons bowser riding on a giant goomba cat mario sliding down slopes to take out an army of baddies go for it you call the shots pass a joycon controller to a partner to build cooperatively on a single system,6600,114,623,459,2
309,Fire Emblem: The Blazing Blade,2003-04-25,"['Intelligent Systems Co Ltd', 'Nintendo']",Intelligent Systems Co Ltd, Nintendo,3.7,609,"['RPG', 'Strategy', 'Tactical']",RPG,Strategy,Tactical,Not applicable,Not applicable,Not applicable,"it is the seventh game of the fire emblem series the second game in the series to be released for the game boy advance and the first to be released in both north america and europe it features a prologue storyline designed to introduce newcomers to fire emblem gameplay and tactical basics the overall narrative is a prequel to the events of the previous game fire emblem the binding blade which is set twenty years later
the game was first released under the localized title fire emblem in the west but it was later rebranded as fire emblem the blazing blade when fire emblem heroes was released",3900,158,1200,401,2
310,LEGO Marvel Super Heroes,2013-09-30,"['WB Games', ""Traveller's Tales""]",WB Games," ""Travellers Tales""",3.6,522,"['Adventure', 'Brawler', 'Puzzle']",Adventure,Brawler,Puzzle,Not applicable,Not applicable,Not applicable,in lego marvel super heroes players will unlock more than 100 characters from across the marvel universe including fan favorites like spiderman iron man wolverine captain america the hulk thor black widow hawkeye deadpool loki and galactus the game will pack in a plethora of supercool character abilities combatlike action sequences epic battle scenes puzzlesolving and a unique story told with playful lego humor,6000,65,592,126,2
311,Sonic Colors,2010-11-11,"['SEGA of America', 'Sonic Team']",SEGA of America, Sonic Team,3.4,609,"['Adventure', 'Platform']",Adventure,Platform,Not applicable,Not applicable,Not applicable,Not applicable,sonic colors titled sonic colours in european and australian markets is a platforming game in the sonic the hedgehog series developed by sonic team and published by sega in 2010 the game was released worldwide for the wii in november 2010 another version featuring different gameplay was also released on the nintendo ds at the same time,5100,44,690,342,2
312,Pokémon Moon,2016-11-18,"['The Pokémon Company', 'Game Freak']",The Pokémon Company, Game Freak,3.3,648,"['Adventure', 'RPG', 'Strategy', 'Turn-Based-Strategy']",Adventure,RPG,Strategy,Turn-Based-Strategy,Not applicable,Not applicable,"pokémon sun and pokémon moon trademarks were registered thus leaking the next pokémon game titles to the public pokémoncom confirmed the games would be for the nintendo 3ds and released in holiday 2016 with a new world new pokémon and new adventures
pokémon sun and pokémon moon will be the first games in the pokémon series to allow players to choose from nine languages to play in in addition to english french german italian japanese korean and spanish players will now be able to play in both traditional and simplified chinese",7900,75,653,234,2
313,Zelda II: The Adventure of Link,1987-01-14,"['Nintendo', 'Nintendo EAD']",Nintendo, Nintendo EAD,2.6,756,"['Adventure', 'RPG']",Adventure,RPG,Not applicable,Not applicable,Not applicable,Not applicable,zelda ii the adventure of link is the second major installment in the legend of zelda series and the direct sequel to the first game like its predecessor it features dungeons that must be located in the overworld and searched for an item that will prove useful however the game presents many very important gameplay changes compared to the previous one affecting especially the movements and the combat moving around the world map involves encounters with enemies that take place on a sidescrolling playfield rather than the topdown perspective for which the series became known,4500,55,1100,290,2
314,Battlefield 4,2013-10-29,"['EA Digital Illusions CE', 'Electronic Arts']",EA Digital Illusions CE, Electronic Arts,3.5,431,['Shooter'],Shooter,Not applicable,Not applicable,Not applicable,Not applicable,Not applicable,battlefield 4 is the genredefining action blockbuster created by dice and made from moments that blur the line between game and glory moments found only in battlefield go to boot camp to learn the basics of battlefield 4s engaging single player and intense multiplayer mode here youll also find intel on levolution commander mode naval warfare and many more exciting game features,7100,72,506,124,2
315,Dragon Ball Z: Budokai Tenkaichi 3,2007-10-04,"['Namco Bandai Games', 'Spike']",Namco Bandai Games, Spike,3.9,435,['Fighting'],Fighting,Not applicable,Not applicable,Not applicable,Not applicable,Not applicable,budokai tenkaichi 3 is a 1vs1 fighting game based on the animemanga dragon ball by akira toriyama it includes the apocalyptic battles and the essence of the dragon ball series following the main story of the popular manga as in the previous games of the series youll have to select your character over 162 characters with their own movements and combos and fight against a friend or the computer in many different game modes with many different stages and weathertime conditions,6600,32,278,135,2
316,WarioWare: Get It Together!,2021-09-09,"['Intelligent Systems', 'Nintendo']",Intelligent Systems, Nintendo,3.5,399,['Arcade'],Arcade,Not applicable,Not applicable,Not applicable,Not applicable,Not applicable,take on over 200 quick and quirky microgames  lightningfast minigames filled with frantic fun  solo or with a friend when his latest harebrained business scheme goes awry wario must use his signature style and smell to fix it how by playing a twisted collection microgames of course from assembling a robot to pulling out a statues armpit hair the warioware get it together game is a comedic cooperative microgame mashup,2200,59,460,636,2
317,Beyond: Two Souls,2013-10-08,"['Quantic Dream', 'Sony Computer Entertainment']",Quantic Dream, Sony Computer Entertainment,2.7,433,['Adventure'],Adventure,Not applicable,Not applicable,Not applicable,Not applicable,Not applicable,a unique psychological action thriller delivered by alist hollywood performances by elliot page and willem dafoe beyond two souls takes you on a thrilling journey across the globe as you play out the remarkable life of jodie holmes,5400,52,1100,524,2
318,Digimon Survive,2022-07-28,"['Bandai Namco Entertainment', 'Witchcraft Inc.']",Bandai Namco Entertainment, Witchcraft Inc.,3.4,167,"['Adventure', 'RPG', 'Simulator', 'Strategy', 'Turn-Based-Strategy']",Adventure,RPG,Simulator,Strategy,Turn-Based-Strategy,Not applicable,"this is a story of survival in a strange new world
celebrating the 20th anniversary of the digimon anime digimon survive presents a brandnew adventure set in a mysterious world with characters designed by uichi ukumo and music by the muchacclaimed tomoki miyoshi
digimon survive sees a brandnew group of teenagers led by takuma momozuka get lost on a school camping trip finding them transported to a strange new world of monsters and danger
as they fight their way back home through an animated world of difficult decisions and deadly battles players’ choices throughout the game will impact the evolution of their monster allies and the final ending battles in the game are fought in 2d in a more classic srpg style",454,148,525,602,2
319,Spiritfarer,2020-08-18,['Thunder Lotus Games'],Thunder Lotus Games,Not applicable,3.9,513,"['Adventure', 'Indie', 'Platform', 'Simulator']",Adventure,Indie,Platform,Simulator,Not applicable,Not applicable,spiritfarer is a cozy management game about dying you play stella ferrymaster to the deceased a spiritfarer build a boat to explore the world then befriend and care for spirits before finally releasing them into the afterlife farm mine fish harvest cook and craft your way across mystical seas join the adventure as daffodil the cat in twoplayer cooperative play spend relaxing quality time with your spirit passengers create lasting memories and ultimately learn how to say goodbye to your cherished friends what will you leave behind,2300,352,1500,918,1
320,Little Nightmares II,2021-02-10,"['Tarsier Studios', 'Bandai Namco Entertainment']",Tarsier Studios, Bandai Namco Entertainment,4.0,569,"['Adventure', 'Platform', 'Puzzle']",Adventure,Platform,Puzzle,Not applicable,Not applicable,Not applicable,"little nightmares ii is a suspenseadventure game in which you play as mono a young boy trapped in a world that has been distorted by the humming transmission of a distant tower with six the girl in a yellow raincoat as his guide mono sets out to discover the dark secrets of the signal tower and save six from her terrible fate but their journey will not be straightforward as mono and six will face a gallery of new threats from the terrible residents of this world
will you dare to face this collection of new little nightmares",2500,78,1200,1500,2
321,The Evil Within 2,2017-10-12,"['Tango Gameworks', 'Bethesda Softworks']",Tango Gameworks, Bethesda Softworks,3.7,541,"['Adventure', 'RPG', 'Shooter']",Adventure,RPG,Shooter,Not applicable,Not applicable,Not applicable,"the evil within 2 is the latest evolution of survival horror detective sebastian castellanos has lost it all but when given a chance to save his daughter he must descend once more into the nightmarish world of stem
horrifying threats emerge from every corner as the world twists and warps around him will sebastian face adversity head on with weapons and traps or sneak through the shadows to survive",2700,76,1400,634,2
322,Bloons TD 6,2018-06-14,['Ninja Kiwi'],Ninja Kiwi,Not applicable,3.8,241,"['Strategy', 'Tactical']",Strategy,Tactical,Not applicable,Not applicable,Not applicable,Not applicable,the bloons are back and better than ever craft your perfect defense from a combination of awesome monkey towers upgrades heroes and activated abilities then pop every last bloon that comes your way,4100,331,343,73,1
323,Sayonara Wild Hearts,2019-09-19,"['Simogo', 'Annapurna Interactive']",Simogo, Annapurna Interactive,3.9,725,"['Adventure', 'Arcade', 'Indie', 'Music']",Adventure,Arcade,Indie,Music,Not applicable,Not applicable,sayonara wild hearts is a euphoric music video dream about being awesome riding motorcycles skateboarding dance battling shooting lasers wielding swords and breaking hearts at 200 mph,3100,37,721,789,2
324,Metro 2033 Redux,2014-08-26,"['Koch Media', '4A Games']",Koch Media, 4A Games,3.6,363,"['Adventure', 'RPG', 'Shooter']",Adventure,RPG,Shooter,Not applicable,Not applicable,Not applicable,"metro 2033 redux is the definitive version of the cult classic metro 2033 rebuilt in the latest and greatest iteration of the 4a engine for next gen fans of the original game will find the unique world of metro transformed with incredible lighting physics and dynamic weather effects newcomers will get the chance to experience one of the finest storydriven shooters of all time an epic adventure combining gripping survival horror exploration and tactical combat and stealth
all the gameplay improvements and features from the acclaimed sequel metro last light have been transferred to metro 2033 redux – superior ai controls animation weapon handling and many more – to create a thrilling experience for newcomers and veterans alike with two unique playstyles and the legendary ranger mode included metro 2033 redux offers hours of aaa gameplay for an incredible price",3900,108,1600,260,2
325,Melty Blood: Type Lumina,2021-09-29,"['Delightworks', 'French Bread']",Delightworks, French Bread,3.6,194,"['Fighting', 'Visual-Novel']",Fighting,Visual-Novel,Not applicable,Not applicable,Not applicable,Not applicable,"melty blood is a series of 2d fighting games based on typemoons visual romance novel tsukihime since the games original release on pc in 2002 it has also had a number of ports for arcade playstation 2 and steam
now at long last the melty blood series is making its way to playstation4 nintendo switch xbox one and steam on september 30 2021 in the form of melty blood type lumina",1800,159,301,473,2
391,Vampire Survivors,2021-12-17,['Poncle'],Poncle,Not applicable,3.7,836,"['Arcade', 'Indie', 'RPG']",Arcade,Indie,RPG,Not applicable,Not applicable,Not applicable,mow thousands of night creatures and survive until dawn vampire survivors is a gothic horror casual game with roguelite elements where your choices can allow you to quickly snowball against the hundreds of monsters that get thrown at you,6100,944,687,409,1
405,Psychonauts,2005-04-19,"['Double Fine Productions', 'Majesco Entertainment']",Double Fine Productions, Majesco Entertainment,4.0,1200,"['Adventure', 'Platform']",Adventure,Platform,Not applicable,Not applicable,Not applicable,Not applicable,a psychic odyssey through the minds of misfits monsters and madmen this classic actionadventure platformer from acclaimed developers double fine productions follows the story of a young psychic named razputin,7100,388,4200,1200,2
406,Fallout 4,2015-11-09,"['Bethesda Game Studios', 'Bethesda Softworks']",Bethesda Game Studios, Bethesda Softworks,3.1,1000,"['RPG', 'Shooter']",RPG,Shooter,Not applicable,Not applicable,Not applicable,Not applicable,bethesda game studios welcome you to the world of fallout 4 their most ambitious game ever and the next generation of openworld gaming as the sole survivor of vault 111 you enter a world destroyed by nuclear war every second is a fight for survival and every choice is yours only you can rebuild and determine the fate of the wasteland welcome home,16000,407,2900,752,2
407,Uncharted 4: A Thief's End,2016-05-10,"['Naughty Dog', 'Sony Interactive Entertainment']",Naughty Dog, Sony Interactive Entertainment,4.1,1800,"['Adventure', 'Shooter']",Adventure,Shooter,Not applicable,Not applicable,Not applicable,Not applicable,several years after his last adventure retired fortune hunter nathan drake is forced back into the world of thieves with the stakes much more personal drake embarks on a globetrotting journey in pursuit of a historical conspiracy behind a fabled pirate treasure his greatest adventure will test his physical limits his resolve and ultimately what hes willing to sacrifice to save the ones he loves,14000,177,2700,1200,2
408,The Legend of Zelda: A Link to the Past,1991-11-21,"['Nintendo EAD', 'St. GIGA']",Nintendo EAD, St. GIGA,4.1,1700,"['Adventure', 'Puzzle', 'RPG']",Adventure,Puzzle,RPG,Not applicable,Not applicable,Not applicable,the legend of zelda a link to the past is a topdown action game with puzzlesolving elements similar to the original the legend of zelda after the sidescrolling and rpglike gameplay of zelda ii the adventure of link the game is a return to the topdown view and gameplay style of the first installment it introduces major new items to the series such as the master sword and the concept of two different worlds which was revisited to some extent in ocarina of time with two distinct time periods rather than dark and light worlds,13000,360,3200,911,2
409,Silent Hill,1999-02-23,"['Konami', 'Team Silent']",Konami, Team Silent,4.1,1300,"['Adventure', 'Puzzle']",Adventure,Puzzle,Not applicable,Not applicable,Not applicable,Not applicable,silent hill is the first installment in the silent hill series of psychological survival horror video games unlike earlier survival horror games that focused on protagonists with combat training the main character harry mason is an average man the gameplay consists of combat exploration and puzzlesolving the controller vibration is used to indicate harrys heartbeat and will vibrate on low health the player must regularly enter an inventory screen to check harrys health use items and equip different weapons,6800,272,2300,1600,2
410,Super Smash Bros. Brawl,2008-01-31,"['Nintendo', 'Sora']",Nintendo, Sora,3.8,1300,"['Fighting', 'Platform']",Fighting,Platform,Not applicable,Not applicable,Not applicable,Not applicable,super smash bros brawl is the third installment in the super smash bros series and the followup to super smash bros melee this edition introduces super attacks referred to as final smashes activated by destroying smash balls these feature powerful and often unstoppable attacks regularly introducing a major transformation of the character this edition also introduces a brand new adventure mode in the subspace emissary which is a sidescrolling adventure in the style of a platformer it retains all basic mechanics of the super smash bros series such as a damage meter stocks and smashstyle attacks,19000,51,511,250,2
411,Borderlands 2,2012-09-18,"['Gearbox Software', '2K Games']",Gearbox Software, 2K Games,3.5,1100,"['RPG', 'Shooter']",RPG,Shooter,Not applicable,Not applicable,Not applicable,Not applicable,a new era of shoot and loot is about to begin play as one of four new vault hunters facing off against a massive new world of creatures psychos and the evil mastermind handsome jack make new friends arm them with a bazillion weapons and fight alongside them in 4 player coop on a relentless quest for revenge and redemption across the undiscovered and unpredictable living planet,16000,344,2700,494,2
412,No More Heroes,2007-12-06,['Grasshopper Manufacture'],Grasshopper Manufacture,Not applicable,4.0,1200,"['Adventure', 'Brawler']",Adventure,Brawler,Not applicable,Not applicable,Not applicable,Not applicable,the journey to become the 1 assassin begins with a single slice no more heroes is the story of travis touchdown he has received orders to kill a vagabond in front of him appears the handsome assassin helter skelter after a fierce skirmish travis eliminates skelter upon which silvia christel arrives she informs travis that his victory was done without uaa permission but he nonetheless becomes the 11th best assassin and so travis’s journey begins no more heroes will offer an exhilarating action experience a thrilling scenario stylish visuals and sounds,5600,280,2600,1800,1
413,Ghost of Tsushima,2020-07-17,"['Sucker Punch Productions', 'Sony Interactive Entertainment']",Sucker Punch Productions, Sony Interactive Entertainment,4.1,1400,"['Adventure', 'Brawler', 'RPG']",Adventure,Brawler,RPG,Not applicable,Not applicable,Not applicable,uncover the hidden wonders of tsushima in this openworld action adventure forge a new path and wage an unconventional war for the freedom of tsushima challenge opponents with your katana master the bow to eliminate distant threats develop stealth tactics to ambush enemies in order to win over the mongols,8500,688,3500,3100,2
512,Sonic the Hedgehog 3 & Knuckles,1994-10-18,"['Sega Technical Institute', 'Sega']",Sega Technical Institute, Sega,4.2,839,['Platform'],Platform,Not applicable,Not applicable,Not applicable,Not applicable,Not applicable,sonic the hedgehog 3  knuckles or simply sonic 3  knuckles or sonic 3 complete edition is a platform video game which is the result of lockingon sonic  knuckles with sonic the hedgehog 3 using the former catridges unique lockon technology it is essentially a large combined game of its two lockon components and contains all zones from the said games and also contains special features unique to this game this would have been the original sonic the hedgehog 3 the developers intended but time constraints by sega resulted in the game being split into two,6000,40,656,269,2
